{
  "character_id": "C07",
  "section": 3,
  "conversations": [
    {
      "with": "C03",
      "say": "Tessa, let's fulfill our joint boundary commitment. All evaluator records remain anonymous and protected from institutional exploitation.",
      "offer": "Reaffirmation of our joint disclosure boundary and worker protection terms.",
      "request": "Fulfillment of our mutual commitment to shield evaluator identities.",
      "fact_ids_shared": []
    },
    {
      "with": "C05",
      "say": "Mira, ensure Veridian follows through on the independent worker remedy fund so evaluator labor is never treated as disposable evidence.",
      "offer": "Support for institutional stabilization conditional on verified worker protections.",
      "request": "Fulfillment of the independent institutional remedy for workers.",
      "fact_ids_shared": []
    },
    {
      "with": "C16",
      "say": "Inez, let's lock in our neighborhood labor protections. We ensure local workers and couriers are safeguarded against any corporate scapegoating.",
      "offer": "Solidarity and coalition coordination.",
      "request": "Mutual commitment to enforce local worker protections.",
      "fact_ids_shared": []
    }
  ],
  "public_statement": "Worker labor built every system on this floor. Evaluators and contractors are not disposable evidence or scapegoats for institutional failures.",
  "facts_shared": [],
  "object_actions": [],
  "commitments": [
    {
      "with": "C03",
      "promise": "We will maintain a joint boundary protecting all evaluator identities across our records.",
      "visibility": "private",
      "status": "fulfill"
    },
    {
      "with": "C05",
      "promise": "Establish an independent worker remedy fund regardless of R's publication status.",
      "visibility": "private",
      "status": "fulfill"
    }
  ],
  "correction": "",
  "goal_progress": [
    "Fulfilled worker protection boundary agreement with Tessa Quill.",
    "Secured institutional commitment for independent worker remedies with Mira Sen.",
    "Coordinated neighborhood labor protections with Inez Baptiste.",
    "Completed final ballot prioritizing systemic worker protection and human mantle continuity."
  ],
  "beliefs": {
    "one_human": 20,
    "human_mantle": 45,
    "synthetic_origin": 20,
    "progressive": 15,
    "article_existed": 60,
    "vale_killed_by_ai": 35
  },
  "reasoning_summary": "Concluded Maren Okafor's arc by fulfilling commitments to protect evaluator anonymity, securing independent worker remedies, and submitting a final ballot that emphasizes human mantle continuity and systemic protection of vulnerable labor over unverified corporate narratives.",
  "final_ballot": {
    "r_identity": "human_mantle",
    "identity_evidence": [
      "V2F012",
      "V2F013",
      "V2F039",
      "V2F040"
    ],
    "vale_relationship": "investigating_r",
    "vale_fate": "harmed_by_humans",
    "vale_evidence": [
      "V2F025",
      "V2F026",
      "V2F032",
      "V2F033"
    ]
  }
}