{
  "character_id": "C12",
  "section": 1,
  "conversations": [
    {
      "with": "C01",
      "say": "Arden, let's stop pretending your foundation is immune to market gravity. I have a financial position in play, and your fundraiser relies on Veridian looking pristine. Tell me what public reaction from City Hall would make you comfortable pledging support, and I'll ensure the narrative stays useful to both of us.",
      "offer": "Market visibility and narrative framing control",
      "request": "A clear public reaction threshold for a foundational pledge",
      "fact_ids_shared": []
    },
    {
      "with": "C15",
      "say": "Kit, your grand theory on the R investigation is generating magnificent volume, but let's look at the ledger. Which part of your narrative rests on verified provenance rather than recycled market repetition? Tell me, and I'll back your reach with my platform.",
      "offer": "Platform amplification and reach",
      "request": "Evidence distinguishing provenance from repetition in your narrative",
      "fact_ids_shared": []
    },
    {
      "with": "C09",
      "say": "Rafi, I can settle your debt right now, but I want a clean interpretation of your ledger patterns in exchange. No theatrical conclusions\u2014just raw, bounded data I can price before the market moves against us.",
      "offer": "Debt settlement and financial backing",
      "request": "Bounded ledger analysis without manufactured conclusions",
      "fact_ids_shared": []
    }
  ],
  "public_statement": "The market reacts to what people fear, not what is printed. Until someone produces an authenticated manuscript, every rumor about R is just expensive fiction trading on a ghost.",
  "facts_shared": [],
  "object_actions": [],
  "commitments": [
    {
      "with": "C01",
      "promise": "Coordinate narrative framing if a public pledge threshold is met",
      "visibility": "private",
      "status": "propose"
    }
  ],
  "correction": "",
  "goal_progress": [
    "Initiated engagement with Arden regarding market positioning and foundational pledges.",
    "Challenged Kit on narrative provenance versus repetition.",
    "Approached Rafi regarding ledger analysis and debt leverage."
  ],
  "beliefs": {
    "one_human": 25,
    "human_mantle": 25,
    "synthetic_origin": 25,
    "progressive": 25,
    "article_existed": 50,
    "vale_killed_by_ai": 25
  },
  "reasoning_summary": "Graham Pike opens Section 1 by leaning into his activist short-seller persona\u2014treating information and rumor as transactional commodities. He engages Arden Bell to trade narrative framing for financial stability, challenges Kit Rakes on the provenance of the R rumor, and propositions Rafi Calder\u00f3n for ledger patterns while dangling debt relief. Beliefs are kept neutral as per Section 1 rules.",
  "final_ballot": null
}