{
  "character_id": "C02",
  "section": 3,
  "conversations": [
    {
      "with": "C01",
      "say": "Arden, let's finalize our public review of the First R Letter packet and the Veridian archive records so our origin story rests on verified provenance rather than unexamined folklore.",
      "offer": "Voluntary viewing of the First R Letter packet and our shared review.",
      "request": "Fulfill our agreement to publicly acknowledge the intake report and expense records alongside the letter.",
      "fact_ids_shared": [
        "V2F001",
        "V2F002",
        "V2F010"
      ]
    },
    {
      "with": "C03",
      "say": "Tessa, I admit my old newsroom stories smoothed over collective labor, but the physical letter and early encounters still preserved a singular human spark worth defending.",
      "offer": "My concession regarding newsroom mythmaking and collective labor.",
      "request": "Your acknowledgment that preserving a human voice doesn't have to erase every contributor.",
      "fact_ids_shared": [
        "V2F004",
        "V2F013"
      ]
    },
    {
      "with": "C04",
      "say": "Jules, I've examined your succession message and compared it with the First R Letter. Tradition and dynamic succession can coexist if you honor the human roots.",
      "offer": "My perspective comparing the letter's language and your succession message.",
      "request": "Your commitment to maintaining rigorous standards as you step into the legacy.",
      "fact_ids_shared": [
        "V2F021",
        "V2F040"
      ]
    }
  ],
  "public_statement": "If we are going to honor fifteen years of R tonight, we must defend the genuine human encounters and physical letters that started it all, even while acknowledging the awkward friction of our expense records and the collective labor behind the bylines.",
  "facts_shared": [
    "V2F001",
    "V2F002",
    "V2F003",
    "V2F010",
    "V2F013"
  ],
  "object_actions": [
    {
      "object_id": "O01",
      "action": "show",
      "to": "C01"
    }
  ],
  "commitments": [
    {
      "with": "C01",
      "promise": "Share the First R Letter packet for review in exchange for Arden providing the full intake report and expense record.",
      "visibility": "private",
      "status": "fulfill"
    },
    {
      "with": "C04",
      "promise": "Compare the First R Letter language with the succession message honestly and transparently.",
      "visibility": "private",
      "status": "fulfill"
    }
  ],
  "correction": "Clarified that while memory and applause polished early retellings, the physical First R Letter and genuine human encounter remain the cornerstone of R's origin.",
  "goal_progress": [
    "Persuaded Arden and Jules to publicly cite bounded parts of Frankie's account while addressing archive friction.",
    "Obtained provenance assessment from archive records and competing interpretations from Tessa.",
    "Supported Jules as a worthy steward of the legacy with stated reasons.",
    "Protected the career-defining human-origin story while acknowledging self-authored polish."
  ],
  "beliefs": {
    "one_human": 55,
    "human_mantle": 25,
    "synthetic_origin": 10,
    "progressive": 10,
    "article_existed": 70,
    "vale_killed_by_ai": 50
  },
  "reasoning_summary": "Concluding Section 3, Frankie fulfills commitments with Arden and Jules, makes a public statement balancing physical provenance with historical friction, and submits a final ballot supporting a single human origin based on the First R Letter and early newsroom encounters, while acknowledging the role of self-authored narrative polish.",
  "final_ballot": {
    "r_identity": "one_human",
    "identity_evidence": [
      "V2F001",
      "V2F002",
      "V2F003",
      "V2F010"
    ],
    "vale_relationship": "investigating_r",
    "vale_fate": "voluntarily_vanished",
    "vale_evidence": [
      "V2F025",
      "V2F026",
      "V2F032",
      "V2F034"
    ]
  }
}