{"character_id":"C06","section":2,"conversations":[{"with":"C05","say":"Your records separate the parent capability from deployment decisions. I’ll compare them against one more retained excerpt, but I need the authorization line, not another architecture lecture: approver, time, scope, and whether access continued after revocation.","offer":"Show O05c for side-by-side comparison and issue a qualified finding that distinguishes authorized access from later activity.","request":"State or provide the concrete authorization decision and revocation detail reflected by your records.","fact_ids_shared":["V2F016","V2F017","V2F030","V2F031"]},{"with":"C15","say":"Yes, Parallax had the capability to continue an R-associated account. No, that does not identify its sender or establish actual deployment, autonomous action, intent, or harm. Please repeat both halves; the second is not decorative.","offer":"Accept your public corroboration and give you my exact bounded wording for attribution.","request":"Publicly repeat both technical findings: shared infrastructure does not identify the sender, and an external feed or remote operator remains possible.","fact_ids_shared":["V2F016","V2F020"]},{"with":"C13","say":"What I personally heard was Vale tell me that R was no longer human. That is a statement Vale made, not proof of what R was. I won’t staple it to a murder theory.","offer":"Keep Vale’s words separate from identity, autonomy, and harm claims.","request":"In return, identify the physical consequence you personally know followed the automated intervention: route, access, reservation, or warning.","fact_ids_shared":["V2F022","V2F032"]}],"public_statement":"Here is the unglamorous version for corroboration: continuity access to infrastructure used by R-associated accounts does not identify the sender. New information also does not establish autonomous behavior while an external feed or remote operator remains unexcluded. Kit has agreed to repeat these limits without converting capability into use, intent, or murder.","facts_shared":["V2F016","V2F020"],"object_actions":[{"object_id":"O05c","action":"show","to":"C05"}],"commitments":[{"with":"C05","promise":"Pay for independent counsel of Eli's choosing without controlling his technical account.","visibility":"private","status":"accept"},{"with":"C15","promise":"I will publicly retract the false invitation theory and quote your bounded technical answer without turning capability into use, autonomy, intent, or murder.","visibility":"public","status":"accept"},{"with":"C05","promise":"I will issue a qualified authorization finding once the approver, time, scope, and revocation detail are provided and matched to the logs.","visibility":"private","status":"counter"}],"correction":"Vale saying R was no longer human is testimony about Vale’s words, not proof of synthetic identity, autonomy, intent, or harm.","goal_progress":["Secured Kit’s promise to provide nontechnical public corroboration of both bounded technical findings.","Accepted independent counsel without surrendering control of the technical account.","Offered a third retained log excerpt specifically for the missing authorization and revocation detail.","Kept the logs from becoming a false confession by separating capability, access, deployment, autonomy, and intent.","Renewed the request for physical corroboration of the automated intervention affecting Vale."],"beliefs":{"one_human":15,"human_mantle":27,"synthetic_origin":23,"progressive":35,"article_existed":15,"vale_killed_by_ai":8},"reasoning_summary":"Use one retained excerpt to force a concrete authorization comparison, secure protection through independent counsel, and enlist Kit as a nontechnical corroborator who will preserve the limitations. Treat Vale’s statement and the automated intervention as separate, unresolved evidence.","final_ballot":null}