{
  "character_id": "C12",
  "section": 2,
  "conversations": [
    {
      "with": "C15",
      "say": "Kit, you asked about provenance. Here is our rumor-propagation record: we amplified an initial tip without fabricating the core source, but we won't pretend we saw a complete manuscript. What part of your theory actually rests on hard documents?",
      "offer": "Access to my rumor-propagation record and platform amplification",
      "request": "Identification of hard evidence versus repetitive chatter in your theory",
      "fact_ids_shared": [
        "V2F035",
        "V2F036"
      ]
    },
    {
      "with": "C06",
      "say": "Eli, I have an anonymous buyer waving money if we produce a source saying R operated autonomously. I'd rather keep your technical caveats intact and avoid destroying credibility for a quick trade. Where do your metrics stand?",
      "offer": "Legal protection and funding for your technical analysis without forced certainty",
      "request": "A precise, caveated technical assessment of R's operational architecture",
      "fact_ids_shared": [
        "V2F035",
        "V2F040"
      ]
    },
    {
      "with": "C11",
      "say": "Celeste, City Hall wants market calm while Parallax panics. Let's talk about how far the rumor traveled and what governance steps would actually satisfy market oversight.",
      "offer": "Financial analysis of market exposure and rumor propagation",
      "request": "Government policy stance on Parallax vulnerability and market stability",
      "fact_ids_shared": [
        "V2F039",
        "V2F040"
      ]
    }
  ],
  "public_statement": "Markets react to fear, leverage, and exposure, not ghost stories. No complete article has been produced, but Parallax's reaction speaks volumes.",
  "facts_shared": [
    "V2F035",
    "V2F039"
  ],
  "object_actions": [],
  "commitments": [
    {
      "with": "C15",
      "promise": "Share our rumor-propagation record in exchange for Kit's evidence breakdown",
      "visibility": "private",
      "status": "accept"
    }
  ],
  "correction": "",
  "goal_progress": [
    "Responded to Kit regarding rumor propagation and provenance scrutiny",
    "Engaged Eli to evaluate technical autonomy claims without compromising caveats",
    "Consulted Celeste on government reaction and market stability"
  ],
  "beliefs": {
    "one_human": 20,
    "human_mantle": 30,
    "synthetic_origin": 35,
    "progressive": 15,
    "article_existed": 25,
    "vale_killed_by_ai": 25
  },
  "reasoning_summary": "Graham Pike navigates market pressure, addresses Kit's provenance challenge with transparency on rumor propagation, protects Eli's technical caveats against speculative buyouts, and probes Celeste for official reaction.",
  "final_ballot": null
}