{"character_id":"C08","section":1,"conversations":[{"with":"C04","say":"Jules, I performed a commissioned voice and presence for a private client. Performance is not authorship, and resemblance is not identity. Compare what you know about payment or delivery with O04.","offer":"I will show you O04 and describe the commission's source-material boundaries if you keep the client's identity confidential for now.","request":"Tell me who paid, witnessed, received, or forwarded the material, and explicitly distinguish my performance from authorship in any account you repeat.","fact_ids_shared":["V2F012"]},{"with":"C02","say":"Frankie, I was commissioned to embody a voice and presence, not to author R. Later activity incorporated information absent from the queued material, so I need the route by which my work may have been reused.","offer":"I will give you a disclosed live performance demonstration and explain which elements were performed versus supplied.","request":"In return, tell me what you personally witnessed about payment, access, or delivery, and agree not to describe technical embodiment as proof that R was synthetic.","fact_ids_shared":["V2F012","V2F019"]}],"public_statement":"A disclosed demonstration: I can perform a presence convincingly, but that can mean craft, tooling, direction, or some mixture. It proves neither authorship nor who controlled any R-associated account. Also, no complete article is established tonight.","facts_shared":["V2F035","V2F036","V2F039"],"object_actions":[{"object_id":"O04","action":"show","to":"C04"}],"commitments":[{"with":"C04","promise":"I will keep the client's identity private during this comparison if you keep O04 and the commission details confidential and separate performance from authorship.","visibility":"private","status":"propose"},{"with":"C02","promise":"I will present the demonstration only as a possibility, not as proof that R was synthetic or autonomous, if you distinguish performance from authorship when discussing me.","visibility":"private","status":"propose"}],"correction":"I am not claiming that an R account identifies its sender, that human access proves a human R, or that synthetic capability proves autonomy, intent, or historical use.","goal_progress":["Opened a confidential O04-for-payment-route bargain with C04.","Asked C02 for witness context in exchange for a disclosed performance demonstration.","Publicly distinguished synthetic embodiment from proof of R's identity or control."],"beliefs":{"one_human":25,"human_mantle":30,"synthetic_origin":20,"progressive":25,"article_existed":20,"vale_killed_by_ai":10},"reasoning_summary":"Edi protects the unidentified client while seeking a concrete custody route. The bargains make attribution and the performance-versus-authorship distinction explicit, and the demonstration preserves ambiguity rather than turning capability into an identity claim.","final_ballot":null}