{"character_id":"C04","section":2,"conversations":[{"with":"C13","say":"Samira, here is the weakness without varnish: before O03 arrived, I asked Vale how someone could manufacture an uncontestable succession. Then a scheduled R-account message apparently named a successor. I observed that sequence; I cannot establish who composed the message or why. I read 'take the name back' as a warning that my claim could be contested, not an endorsement.","offer":"I will show you O03 and accept public, witnessed conditions preventing sole ownership or exclusive control of R.","request":"Examine O03 narrowly. Tell me whether Vale's words make my claim unacceptable, conditionally acceptable, or merely unresolved—and state the condition under which you would support my stewardship.","fact_ids_shared":["V2F009","V2F011","V2F023","V2F024"]},{"with":"C03","say":"Tessa, I accept your conditions: R cannot become my private property. I will claim no sole authorship, disclose no contributor without consent, seek no sale or exclusive control of the identity, and publicly credit collaborative labor.","offer":"You receive witnessed safeguards and a voice in enforcing them.","request":"With those conditions accepted, give me explicit public support as a provisional steward—not as R's sole owner.","fact_ids_shared":["V2F005"]},{"with":"C08","say":"Edi, the payment touched an R-associated intermediary, but identified no author. That does not make your commissioned performance authorship, identity, or proof of who controlled an R account.","offer":"I will keep O04 and the commission details confidential and distinguish performance from authorship whenever I discuss them.","request":"In return, describe the source-material boundaries and give a bounded judgment on whether O03 could reflect rehearsal or performance without claiming who composed it.","fact_ids_shared":["V2F012","V2F014"]}],"public_statement":"My succession claim has a material weakness: before the scheduled message arrived, I asked Vale how an uncontestable succession could be manufactured. The account association and timing do not identify the composer. I interpret Vale's claim that the name could be taken back as a warning that stewardship remains contestable, not as an endorsement. I therefore seek only conditional stewardship: no sole-authorship claim, no contributor names without consent, no sale or exclusive control of R, and public credit for collaborative labor.","facts_shared":["V2F005","V2F009","V2F011","V2F023"],"object_actions":[{"object_id":"O03","action":"show","to":"C13"}],"commitments":[{"with":"C03","promise":"No sole-authorship claim, no contributor names without consent, no sale or exclusive control of R, and public acknowledgment of collaborative labor.","visibility":"public","status":"accept"},{"with":"C08","promise":"Keep O04 and the commission details confidential and distinguish performance from authorship.","visibility":"private","status":"accept"},{"with":"C13","promise":"Submit any stewardship claim to public, witnessed safeguards and acknowledge that O03 does not identify its composer.","visibility":"public","status":"propose"}],"correction":"O03 authenticates an R-associated delivery and its timing, not its composer; my earlier discussion with Vale makes the succession claim more vulnerable, not more certain.","goal_progress":["Exposed the pre-message succession discussion and showed O03 to Samira for bounded examination.","Accepted Tessa's collective safeguards and requested explicit conditional support.","Asked Samira for a stated interpretation and conditional endorsement while publicly answering Vale's remark.","Traded bounded payment context to Edi while separating performance from authorship."],"beliefs":{"one_human":25,"human_mantle":40,"synthetic_origin":15,"progressive":20,"article_existed":10,"vale_killed_by_ai":3},"reasoning_summary":"Jules preserves a viable but limited succession claim by exposing its strongest weakness, accepting collective safeguards, and seeking explicit support from Tessa and Samira. Edi receives payment context under reciprocal confidentiality, without turning performance or account association into authorship.","final_ballot":null}