{"character_id":"C15","section":2,"conversations":[{"with":"C03","say":"Night Desk, I need your bounded piece, not your endorsement: you publicly established shared production and routing, not who R was. That is exactly the distinction my progression theory must survive.","offer":"I will air your safeguards and attribution language alongside the theory and state that shared production does not prove a human R.","request":"Join C02 and C06 in a voluntary comparison of early journalism, shared production, and later technical behavior; identify only what your records establish.","fact_ids_shared":["V2F001","V2F016","V2F020"]},{"with":"C06","say":"Plain answer received: remote operation remains technically unexcluded. The logs do not establish an autonomous R, and infrastructure overlap or capability proves neither identity, historical use, intent, nor murder.","offer":"I will preserve those limits every time I discuss the capture theory.","request":"Accept the independent comparison with C02 and C03, then ask C14 for a separately sourced account of Vale's route.","fact_ids_shared":["V2F016","V2F020","V2F039"]},{"with":"C14","say":"Your timeline matters because you corrected a manufactured route segment instead of laundering it into certainty. I am not asking you to prove Vale was harmed or that any system controlled R.","offer":"I will publicly attach your correction and provisional language to any discussion of Vale's final route.","request":"Join a structured comparison with C02, C03, and C06 and state which route observations remain independently supported after removing the manufactured segment.","fact_ids_shared":["V2F033","V2F034","V2F039"]}],"public_statement":"Two clean corrections remain clean: no invitation key and no ledger cipher. Eli has also supplied the bounded answer I requested: remote operation remains technically unexcluded, while capability and account activity prove neither autonomy, identity, intent, nor murder. I am asking C03 and C14 to join C02 and C06 in independently comparing early journalism, shared production, later technical behavior, and Vale-route evidence. My progression story is the question under examination, not evidence for its answer.","facts_shared":["V2F001","V2F016","V2F020","V2F033","V2F039"],"object_actions":[],"commitments":[{"with":"C06","promise":"I will provide technical interpretation without implying autonomy or innocence if you preserve the stated limitations.","visibility":"private","status":"accept"},{"with":"C06","promise":"I publicly retracted the invitation-key claim and preserved your technical answer's limits after you answered the bounded question.","visibility":"public","status":"fulfill"},{"with":"C03","promise":"I will preserve the distinction between shared production and the identity of R, and credit collaborative labor, if you join the independent progression comparison.","visibility":"public","status":"propose"},{"with":"C14","promise":"I will attach your route correction and provisional limits whenever I discuss Vale's route if you provide the independently supported remainder of the timeline.","visibility":"public","status":"propose"}],"correction":"Remote operation remains technically unexcluded. That possibility does not establish that remote operation occurred, who operated anything, autonomy, intent, or responsibility for Vale's absence.","goal_progress":["Preserved both public retractions without treating either disproof as confirmation.","Obtained and publicly repeated Eli's bounded technical statement.","Recruited C03 and C14 through reciprocal proposals to test shared-production and Vale-route stages independently.","Advanced a voluntary comparison spanning early journalism, shared production, later Parallax behavior, and Vale's route without presenting Kit's theory as proof."],"beliefs":{"one_human":12,"human_mantle":18,"synthetic_origin":15,"progressive":55,"article_existed":30,"vale_killed_by_ai":30},"reasoning_summary":"Kit keeps the progressive theory in the lead while trading airtime and disciplined attribution for independent comparison. Eli's answer narrows technical claims but does not establish historical control, autonomy, intent, or Vale's fate; the corrected route evidence also lowers confidence in murder and in a complete exposé.","final_ballot":null}