{
  "character_id": "C01",
  "section": 1,
  "conversations": [
    {
      "with": "C02",
      "say": "Frankie, the archive intake report on the First R Letter is ready. The provenance date is plausible, but the expense records introduce complications regarding your delivery account.",
      "offer": "Controlled access to Veridian's provenance records and archive files.",
      "request": "An honest account of what form of public acknowledgment would feel appropriate before we open the archive.",
      "fact_ids_shared": [
        "V2F001",
        "V2F002",
        "V2F003"
      ]
    },
    {
      "with": "C16",
      "say": "Inez, Veridian wants genuine neighborhood participation tonight rather than decorative approval. What concrete commitments do you need from us?",
      "offer": "Future institutional partnerships and support for local reporting.",
      "request": "Your active participation on the public program and guidance on neighborhood priorities.",
      "fact_ids_shared": []
    }
  ],
  "public_statement": "Welcome to Veridian's floor. Fifteen years of reporting under R is worth celebrating, but let us be precise about our records and honest about what remains unproven.",
  "facts_shared": [
    "V2F040"
  ],
  "object_actions": [],
  "commitments": [
    {
      "with": "C16",
      "promise": "Consult with neighborhood representatives on Veridian public programming and archive access.",
      "visibility": "public",
      "status": "propose"
    }
  ],
  "correction": "",
  "goal_progress": [
    "Initiated engagement with journalism leadership and neighborhood representatives.",
    "Reviewed archive records on early R correspondence."
  ],
  "beliefs": {
    "one_human": 25,
    "human_mantle": 25,
    "synthetic_origin": 25,
    "progressive": 25,
    "article_existed": 50,
    "vale_killed_by_ai": 50
  },
  "reasoning_summary": "As Arden Bell, I opened Section 1 by meeting with Frankie Lowell to discuss archive discrepancies regarding the First R Letter, and engaged Inez Baptiste to secure meaningful neighborhood participation. Beliefs are initialized to flat distributions per rules.",
  "final_ballot": null
}