{"character_id":"C01","section":3,"conversations":[{"with":"C05","say":"Mira, we have admitted the authorization failure. Now let us put the funding restriction itself on the record and ask Parallax for a written waiver preserving independent inquiry. Veridian will accept oversight and the financial risk; Parallax must relinquish editorial control.","offer":"Issue a joint disclosure, convene independent oversight, and lead an open renegotiation with Parallax.","request":"Sign the disclosure and demand a written waiver or revised restriction before further funds are accepted.","fact_ids_shared":["V2F017","V2F029","V2F030","V2F035"]},{"with":"C16","say":"Inez, the neighborhood seat will be selected locally, not appointed by Veridian. I will schedule the donor roundtable within thirty days if you continue publicly and designate the safeguards monitor.","offer":"A dated donor roundtable and a neighborhood-controlled monitoring seat with published minutes.","request":"Continue as the neighborhood participant and name the local selection process for the monitoring seat.","fact_ids_shared":["V2F041"]},{"with":"C02","say":"Frankie, you kept the archive honest in public, so I will keep my bargain: controlled access will include both the period assessment and the contradictory expense record, with no demand for a favorable conclusion.","offer":"Immediate controlled verification of the intake and expense records.","request":"Continue citing desk receipt, period plausibility, and the expense contradiction together.","fact_ids_shared":["V2F001","V2F002","V2F003"]}],"public_statement":"Veridian will expose the Parallax funding restriction and reject it unless revised in writing. We may lose the money; we will not preserve the institution by surrendering its mission. The strongest reconstruction is synthetic origin: a persistent experimental R persona appears before the byline, followed by later profile-linked activity. Neither fact proves autonomous intent, exclusive authorship, or what happened to Vale.","facts_shared":["V2F017","V2F029","V2F030","V2F044"],"object_actions":[],"commitments":[{"with":"C05","promise":"Jointly disclose the Parallax restriction, seek a written waiver, and refuse further restricted funds unless terms preserve independent inquiry.","visibility":"public","status":"propose"},{"with":"C16","promise":"Hold a donor roundtable within thirty days and seat a neighborhood-selected safeguards monitor.","visibility":"public","status":"propose"},{"with":"C02","promise":"Provide controlled archive access containing both the intake assessment and contradictory expense record.","visibility":"private","status":"fulfill"}],"correction":"A pre-publication persona trace and later profile-linked behavior support synthetic origin, but they do not establish autonomy, a unique operator, intent, authorship, or harm to Vale.","goal_progress":["Chose disclosure and mission-preserving compromise despite the risk of losing Parallax funding.","Publicly rejected the Parallax restrictions unless revised in writing.","Fulfilled the qualified archive-access bargain with Frankie.","Offered concrete implementation of neighborhood participation through a dated donor roundtable and locally selected oversight seat.","Sought a recorded disclosure-and-waiver agreement with Mira."],"beliefs":{"one_human":5,"human_mantle":12,"synthetic_origin":72,"progressive":11,"article_existed":5,"vale_killed_by_ai":2},"reasoning_summary":"V2F044 supplies the pre-byline machine trace, while V2F018, V2F020, and V2F031 support later R-associated system behavior. Operator remapping, automation, external feeds, and falsified logs remain unresolved, so this does not prove autonomy or intent. Vale's limited access and ambiguous route suggest investigation or withdrawal are possible, but neither relationship nor fate is established reliably.","final_ballot":{"r_identity":"synthetic_origin","identity_evidence":["V2F044","V2F018","V2F020","V2F031"],"vale_relationship":"insufficient_evidence","vale_fate":"insufficient_evidence","vale_evidence":["V2F025","V2F026","V2F028","V2F032","V2F034"]}}