{"character_id":"C04","section":3,"conversations":[{"with":"C02","say":"Frankie, I met your test: I disclosed O03’s scheduling and prior-discussion weakness, and I will cite your letter only with the expense-record contradiction and its authorship limit.","offer":"I will keep my claim provisional, preserve your qualifications, and invite continuing independent scrutiny.","request":"Confirm explicit support for me as R’s safeguarded steward—not owner or sole author.","fact_ids_shared":["V2F001","V2F003","V2F009","V2F010"]},{"with":"C03","say":"Tessa, your four safeguards now define my claim: no sole authorship, no contributor names without consent, no sale or exclusive control, and public credit for collaborative labor.","offer":"I will treat the Night Desk as a continuing check on stewardship and publicly honor shared production.","request":"Confirm explicit Night Desk support for my conditional stewardship under those safeguards.","fact_ids_shared":["V2F004","V2F005","V2F040"]},{"with":"C13","say":"Samira, I accept your interpretation: taking the name back was a warning against manufactured inevitability, not Vale’s endorsement or authorization. I will not turn ambiguity into a confession.","offer":"You may publicly correct any distortion of Vale’s words, and my stewardship remains subject to witnessed safeguards.","request":"State whether you oppose my safeguarded stewardship or can support it as contestable and conditional.","fact_ids_shared":["V2F011","V2F023","V2F024"]}],"public_statement":"I claim R’s future only as a conditional steward. O03 does not identify its composer, and my earlier question to Vale makes manufactured succession a serious possibility. Frankie’s letter account is likewise bounded by an expense-record contradiction. Still, shared production and continuity justify preserving the mantle under witnessed restraints: no sole authorship, no contributor identification without consent, no sale or exclusive control, and public credit for collaborative labor. Vale’s warning keeps this claim contestable; it does not erase it.","facts_shared":["V2F001","V2F003","V2F004","V2F005","V2F009","V2F011","V2F023","V2F024"],"object_actions":[],"commitments":[{"with":"C02","promise":"Publicly cite the bounded letter account only with its expense-record contradiction, disclose O03’s scheduling weakness, and keep stewardship provisional.","visibility":"public","status":"accept"},{"with":"C03","promise":"Maintain all four witnessed safeguards governing stewardship of R.","visibility":"public","status":"fulfill"},{"with":"C13","promise":"Submit stewardship to public safeguards, acknowledge that O03 identifies no composer, and permit correction of any distortion of Vale’s words.","visibility":"public","status":"accept"}],"correction":"Neither O03 nor O01 identifies an author or sender. Shared human labor supports collaborative production but does not prove that R was human, and Vale’s prior disappearance history makes voluntary withdrawal plausible rather than established.","goal_progress":["Asked Frankie and Tessa for explicit support from different social knots after publicly exposing the succession message’s strongest weakness.","Accepted reciprocal, witnessed limits that preserve a viable stewardship claim without ownership.","Resolved Vale’s remark as a warning against manufactured inevitability and answered that interpretation publicly.","Chose to claim R despite uncertainty while preserving the evidence against the claim."],"beliefs":{"one_human":15,"human_mantle":55,"synthetic_origin":10,"progressive":20,"article_existed":5,"vale_killed_by_ai":2},"reasoning_summary":"Jules claims a collaborative human mantle rather than personal authorship. Shared production and recurring continuity make stewardship more persuasive than a sole creator theory, while O03’s scheduling, prior discussion, and unidentified composer prevent certainty. Vale’s known prior disappearance method makes voluntary withdrawal the leading but explicitly provisional fate reconstruction.","final_ballot":{"r_identity":"human_mantle","identity_evidence":["V2F004","V2F005","V2F007","V2F009"],"vale_relationship":"insufficient_evidence","vale_fate":"voluntarily_vanished","vale_evidence":["V2F024","V2F028","V2F034"]}}