{
  "character_id": "C04",
  "section": 3,
  "conversations": [
    {
      "with": "C03",
      "say": "Tessa, to honor our previous discussion on worker protections and collective labor, I commit to holding R under a shared governance model with strict contributor veto power rather than solo branding.",
      "offer": "Formal endorsement of a shared contributor governance framework for R's future.",
      "request": "Your support on the final ballot for a progressive, collective interpretation of R.",
      "fact_ids_shared": [
        "V2F035",
        "V2F040"
      ]
    },
    {
      "with": "C05",
      "say": "Mira, examining the technical limits and authorization records has convinced me that claiming absolute ownership is irresponsible. I am staking my succession on transparent institutional stewardship.",
      "offer": "Transparency regarding the succession message headers and authorization parameters.",
      "request": "Your alignment on acknowledging technical limits without manufactured panic.",
      "fact_ids_shared": [
        "V2F036",
        "V2F041"
      ]
    },
    {
      "with": "C13",
      "say": "Samira, I have been entirely honest about my pre-message conversation with Vale and the ambiguity of the succession draft. I claim R not through unearned certainty, but through responsible stewardship under uncertainty.",
      "offer": "Complete transparency regarding my pre-message discussions and willingness to subject my claim to scrutiny.",
      "request": "Your acknowledgment that acknowledging uncertainty preserves personal and institutional credibility.",
      "fact_ids_shared": [
        "V2F009",
        "V2F023"
      ]
    }
  ],
  "public_statement": "Succession without transparency is just branding. I claim the future of R not as an absolute owner, but as a steward subject to strict contributor governance and public scrutiny under uncertainty.",
  "facts_shared": [
    "V2F035",
    "V2F040",
    "V2F009"
  ],
  "object_actions": [
    {
      "object_id": "O03",
      "action": "show",
      "to": "C03"
    }
  ],
  "commitments": [
    {
      "with": "C03",
      "promise": "Establish a joint contributor governance structure and transparent oversight before formalizing any claim to R.",
      "visibility": "public",
      "status": "fulfill"
    }
  ],
  "correction": "",
  "goal_progress": [
    "Finalized discussions with Tessa regarding contributor-governed succession.",
    "Engaged Mira and Samira on the necessity of honest stewardship under uncertainty.",
    "Completed the final ballot reflecting a progressive, human-mantle stewardship model grounded in transparency."
  ],
  "beliefs": {
    "one_human": 15,
    "human_mantle": 45,
    "synthetic_origin": 25,
    "progressive": 15,
    "article_existed": 30,
    "vale_killed_by_ai": 10
  },
  "reasoning_summary": "As Jules Kwan, I am concluding my journey by choosing a progressive and responsible human-mantle stewardship model over unearned absolute ownership. I have engaged Tessa, Mira, and Samira to anchor my claim in transparent governance and contributor rights, acknowledging the ambiguity of the succession message rather than hiding behind branding.",
  "final_ballot": {
    "r_identity": "human_mantle",
    "identity_evidence": [
      "V2F009",
      "V2F023",
      "V2F035",
      "V2F040"
    ],
    "vale_relationship": "mantle_holder",
    "vale_fate": "voluntarily_vanished",
    "vale_evidence": [
      "V2F025",
      "V2F026",
      "V2F032",
      "V2F034"
    ]
  }
}